{"apiRequirements":[],"apiSurfaces":[{"apiId":"storage.object.delete","document":"api/object-delete.openapi.yaml","documentDigest":"sha256:049871d925795569065f168224007bdba22b9748fdf487ab350fa30af9c94057","version":"1.0.0"},{"apiId":"storage.object.get","document":"api/object-get.openapi.yaml","documentDigest":"sha256:aa39ce1ce7d08044907860f93329650c42996c18335214673c0a8ee8045e2c71","version":"1.0.0"},{"apiId":"storage.object.head","document":"api/object-head.openapi.yaml","documentDigest":"sha256:336ab0e774046d086b7f5f0a031c0cebf74b196bc954f9d49d01e54a58da70e2","version":"1.0.0"},{"apiId":"storage.object.put","document":"api/object-put.openapi.yaml","documentDigest":"sha256:2bf4536aef91c2738ea3ed15d88dec8c7a01f297c8d31fecbd3d75a343103280","version":"1.0.0"}],"compilerVersion":"1.0.0","configSchema":{"digest":"sha256:42bcb2dc45ef13140838535e3166ff436cbb418cc8c63b9720d01e9329ffe7ce","path":"config.schema.json"},"displayName":"Storage Service","events":{"publishes":[],"subscribes":[]},"exposures":[],"frontends":[],"migrations":[],"operations":[{"apiId":"storage.object.delete","apiVersion":"1.0.0","audience":"internal","auth":"required","method":"DELETE","operationId":"deleteStorageObject","parameters":[{"location":"header","name":"X-OJOS-Expected-Sha256","required":true,"schema":{"pattern":"^[a-f0-9]{64}$","type":"string"},"schemaDigest":"sha256:8d84283928a18afc6b4779cb3228cd62604f6ad9cde3e0bed92e62123da700e9"},{"location":"header","name":"X-OJOS-Expected-Size","required":true,"schema":{"format":"int64","minimum":0,"type":"integer"},"schemaDigest":"sha256:4af8b73b58062da04f6d42f3b6e9c1536747d11f973763c7f6e9576f259c18ec"},{"location":"path","name":"bucket","required":true,"schema":{"pattern":"^[a-z0-9][a-z0-9.-]{1,62}$","type":"string"},"schemaDigest":"sha256:a496fc30e5a967ddb0f5a627a732501c937f54ead8f69b36bbfff2245ab91d0b"},{"location":"path","name":"key","required":true,"schema":{"maxLength":1024,"minLength":1,"pattern":"^[^/]+$","type":"string"},"schemaDigest":"sha256:b1d75a18fa0d3ecd5723eaf9f197e044428fd630076ac08ef932280cf660c718"}],"permission":"storage.object.delete","permissionScope":"system","providerPath":"/{bucket}/{key}","responses":[{"content":[{"mediaType":"application/json","schema":{"additionalProperties":false,"properties":{"deleted":{"const":true,"type":"boolean"}},"required":["deleted"],"type":"object"},"schemaDigest":"sha256:dfcd1e653de172182efa2ed16260de864cd2075d4b2d710371e3b492f724a300"}],"status":"200"},{"content":[],"status":"400"},{"content":[],"status":"401"},{"content":[],"status":"412"}]},{"apiId":"storage.object.get","apiVersion":"1.0.0","audience":"internal","auth":"anonymous","method":"GET","operationId":"storageHealth","parameters":[],"providerPath":"/healthz","responses":[{"content":[],"status":"200"}]},{"apiId":"storage.object.get","apiVersion":"1.0.0","audience":"internal","auth":"anonymous","method":"GET","operationId":"storageReady","parameters":[],"providerPath":"/readyz","responses":[{"content":[],"status":"200"},{"content":[],"status":"503"}]},{"apiId":"storage.object.get","apiVersion":"1.0.0","audience":"internal","auth":"required","method":"GET","operationId":"getStorageObject","parameters":[{"location":"path","name":"bucket","required":true,"schema":{"pattern":"^[a-z0-9][a-z0-9.-]{1,62}$","type":"string"},"schemaDigest":"sha256:a496fc30e5a967ddb0f5a627a732501c937f54ead8f69b36bbfff2245ab91d0b"},{"location":"path","name":"key","required":true,"schema":{"maxLength":1024,"minLength":1,"pattern":"^[^/]+$","type":"string"},"schemaDigest":"sha256:b1d75a18fa0d3ecd5723eaf9f197e044428fd630076ac08ef932280cf660c718"}],"permission":"storage.object.read","permissionScope":"system","providerPath":"/{bucket}/{key}","responses":[{"content":[{"mediaType":"application/octet-stream","schema":{"format":"binary","maxLength":536870912,"type":"string"},"schemaDigest":"sha256:b59fb230a42e6430e1fd83a90db268a5b7709148d6ac19e6a4a79bed7ab10c36"}],"status":"200"},{"content":[],"status":"401"},{"content":[],"status":"404"}]},{"apiId":"storage.object.head","apiVersion":"1.0.0","audience":"internal","auth":"required","method":"HEAD","operationId":"headStorageObject","parameters":[{"location":"path","name":"bucket","required":true,"schema":{"pattern":"^[a-z0-9][a-z0-9.-]{1,62}$","type":"string"},"schemaDigest":"sha256:a496fc30e5a967ddb0f5a627a732501c937f54ead8f69b36bbfff2245ab91d0b"},{"location":"path","name":"key","required":true,"schema":{"maxLength":1024,"minLength":1,"pattern":"^[^/]+$","type":"string"},"schemaDigest":"sha256:b1d75a18fa0d3ecd5723eaf9f197e044428fd630076ac08ef932280cf660c718"}],"permission":"storage.object.read","permissionScope":"system","providerPath":"/{bucket}/{key}","responses":[{"content":[],"status":"200"},{"content":[],"status":"401"},{"content":[],"status":"404"}]},{"apiId":"storage.object.put","apiVersion":"1.0.0","audience":"internal","auth":"required","method":"PUT","operationId":"putStorageObject","parameters":[{"location":"header","name":"If-None-Match","required":false,"schema":{"const":"*","type":"string"},"schemaDigest":"sha256:4cc14e12fb3682aa3198e671bb4768b7959087fcd64df5f2e6f796257e13dc67"},{"location":"header","name":"X-OJOS-Content-Sha256","required":false,"schema":{"pattern":"^[a-f0-9]{64}$","type":"string"},"schemaDigest":"sha256:8d84283928a18afc6b4779cb3228cd62604f6ad9cde3e0bed92e62123da700e9"},{"location":"path","name":"bucket","required":true,"schema":{"pattern":"^[a-z0-9][a-z0-9.-]{1,62}$","type":"string"},"schemaDigest":"sha256:a496fc30e5a967ddb0f5a627a732501c937f54ead8f69b36bbfff2245ab91d0b"},{"location":"path","name":"key","required":true,"schema":{"maxLength":1024,"minLength":1,"pattern":"^[^/]+$","type":"string"},"schemaDigest":"sha256:b1d75a18fa0d3ecd5723eaf9f197e044428fd630076ac08ef932280cf660c718"}],"permission":"storage.object.write","permissionScope":"system","providerPath":"/{bucket}/{key}","requestBody":{"content":[{"mediaType":"application/octet-stream","schema":{"format":"binary","maxLength":536870912,"type":"string"},"schemaDigest":"sha256:b59fb230a42e6430e1fd83a90db268a5b7709148d6ac19e6a4a79bed7ab10c36"}],"required":true},"responses":[{"content":[{"mediaType":"application/json","schema":{"additionalProperties":false,"properties":{"bucket":{"type":"string"},"content_type":{"type":"string"},"key":{"type":"string"},"sha256":{"pattern":"^[a-f0-9]{64}$","type":"string"},"size_bytes":{"format":"int64","minimum":0,"type":"integer"},"updated_at":{"format":"date-time","type":"string"}},"required":["bucket","key","size_bytes","sha256","content_type","updated_at"],"type":"object"},"schemaDigest":"sha256:8615ca218d4a795bcdff285e008a9d5c0ea7ac749f177c72e9e4c33bc4d330dc"}],"status":"200"},{"content":[],"status":"400"},{"content":[],"status":"401"},{"content":[],"status":"412"}]}],"packageRequirements":[],"permissions":[{"key":"storage.object.delete","title":"Delete stored objects conditionally"},{"key":"storage.object.read","title":"Read stored objects"},{"key":"storage.object.write","title":"Store immutable objects"}],"resourceClaims":[],"routes":[],"runtime":{"artifact":"storage-runtime","health":{"path":"/readyz"},"httpPort":8085,"profile":"standard-container-v1","volumes":[]},"schemaVersion":"ojos.dev/service-contract/v3","serviceId":"storage-service","serviceVersion":"0.1.0","sourceDigest":"sha256:9958b27ddfca511e0fc3232e4e079dba063a0d76298e08d69030c3b783876948"}